{
  "id": "page-50",
  "slug": "/page-50",
  "title": "Page with 50 blocks",
  "blocks": [
    {
      "id": "hero-0001",
      "type": "hero",
      "content": {
        "title": "Hero 1",
        "description": "Lorem ipsum dolor sit amet, consectetur adipiscing elit."
      }
    },
    {
      "id": "text-0002",
      "type": "text",
      "content": {
        "text": "Lorem ipsum dolor sit amet, consectetur adipiscing elit. Sed do eiusmod tempor incididunt ut labore et dolore magna aliqua."
      }
    },
    {
      "id": "image-0003",
      "type": "image",
      "content": {
        "src": "/images/image-3.jpg",
        "alt": "Image 3"
      }
    },
    {
      "id": "button-0004",
      "type": "button",
      "content": {
        "label": "Button 4",
        "href": "/page-4"
      }
    },
    {
      "id": "hero-0005",
      "type": "hero",
      "content": {
        "title": "Hero 5",
        "description": "Lorem ipsum dolor sit amet, consectetur adipiscing elit."
      }
    },
    {
      "id": "text-0006",
      "type": "text",
      "content": {
        "text": "Lorem ipsum dolor sit amet, consectetur adipiscing elit. Sed do eiusmod tempor incididunt ut labore et dolore magna aliqua."
      }
    },
    {
      "id": "image-0007",
      "type": "image",
      "content": {
        "src": "/images/image-7.jpg",
        "alt": "Image 7"
      }
    },
    {
      "id": "button-0008",
      "type": "button",
      "content": {
        "label": "Button 8",
        "href": "/page-8"
      }
    },
    {
      "id": "hero-0009",
      "type": "hero",
      "content": {
        "title": "Hero 9",
        "description": "Lorem ipsum dolor sit amet, consectetur adipiscing elit."
      }
    },
    {
      "id": "text-0010",
      "type": "text",
      "content": {
        "text": "Lorem ipsum dolor sit amet, consectetur adipiscing elit. Sed do eiusmod tempor incididunt ut labore et dolore magna aliqua."
      }
    },
    {
      "id": "image-0011",
      "type": "image",
      "content": {
        "src": "/images/image-11.jpg",
        "alt": "Image 11"
      }
    },
    {
      "id": "button-0012",
      "type": "button",
      "content": {
        "label": "Button 12",
        "href": "/page-12"
      }
    },
    {
      "id": "hero-0013",
      "type": "hero",
      "content": {
        "title": "Hero 13",
        "description": "Lorem ipsum dolor sit amet, consectetur adipiscing elit."
      }
    },
    {
      "id": "text-0014",
      "type": "text",
      "content": {
        "text": "Lorem ipsum dolor sit amet, consectetur adipiscing elit. Sed do eiusmod tempor incididunt ut labore et dolore magna aliqua."
      }
    },
    {
      "id": "image-0015",
      "type": "image",
      "content": {
        "src": "/images/image-15.jpg",
        "alt": "Image 15"
      }
    },
    {
      "id": "button-0016",
      "type": "button",
      "content": {
        "label": "Button 16",
        "href": "/page-16"
      }
    },
    {
      "id": "hero-0017",
      "type": "hero",
      "content": {
        "title": "Hero 17",
        "description": "Lorem ipsum dolor sit amet, consectetur adipiscing elit."
      }
    },
    {
      "id": "text-0018",
      "type": "text",
      "content": {
        "text": "Lorem ipsum dolor sit amet, consectetur adipiscing elit. Sed do eiusmod tempor incididunt ut labore et dolore magna aliqua."
      }
    },
    {
      "id": "image-0019",
      "type": "image",
      "content": {
        "src": "/images/image-19.jpg",
        "alt": "Image 19"
      }
    },
    {
      "id": "button-0020",
      "type": "button",
      "content": {
        "label": "Button 20",
        "href": "/page-20"
      }
    },
    {
      "id": "hero-0021",
      "type": "hero",
      "content": {
        "title": "Hero 21",
        "description": "Lorem ipsum dolor sit amet, consectetur adipiscing elit."
      }
    },
    {
      "id": "text-0022",
      "type": "text",
      "content": {
        "text": "Lorem ipsum dolor sit amet, consectetur adipiscing elit. Sed do eiusmod tempor incididunt ut labore et dolore magna aliqua."
      }
    },
    {
      "id": "image-0023",
      "type": "image",
      "content": {
        "src": "/images/image-23.jpg",
        "alt": "Image 23"
      }
    },
    {
      "id": "button-0024",
      "type": "button",
      "content": {
        "label": "Button 24",
        "href": "/page-24"
      }
    },
    {
      "id": "hero-0025",
      "type": "hero",
      "content": {
        "title": "Hero 25",
        "description": "Lorem ipsum dolor sit amet, consectetur adipiscing elit."
      }
    },
    {
      "id": "text-0026",
      "type": "text",
      "content": {
        "text": "Lorem ipsum dolor sit amet, consectetur adipiscing elit. Sed do eiusmod tempor incididunt ut labore et dolore magna aliqua."
      }
    },
    {
      "id": "image-0027",
      "type": "image",
      "content": {
        "src": "/images/image-27.jpg",
        "alt": "Image 27"
      }
    },
    {
      "id": "button-0028",
      "type": "button",
      "content": {
        "label": "Button 28",
        "href": "/page-28"
      }
    },
    {
      "id": "hero-0029",
      "type": "hero",
      "content": {
        "title": "Hero 29",
        "description": "Lorem ipsum dolor sit amet, consectetur adipiscing elit."
      }
    },
    {
      "id": "text-0030",
      "type": "text",
      "content": {
        "text": "Lorem ipsum dolor sit amet, consectetur adipiscing elit. Sed do eiusmod tempor incididunt ut labore et dolore magna aliqua."
      }
    },
    {
      "id": "image-0031",
      "type": "image",
      "content": {
        "src": "/images/image-31.jpg",
        "alt": "Image 31"
      }
    },
    {
      "id": "button-0032",
      "type": "button",
      "content": {
        "label": "Button 32",
        "href": "/page-32"
      }
    },
    {
      "id": "hero-0033",
      "type": "hero",
      "content": {
        "title": "Hero 33",
        "description": "Lorem ipsum dolor sit amet, consectetur adipiscing elit."
      }
    },
    {
      "id": "text-0034",
      "type": "text",
      "content": {
        "text": "Lorem ipsum dolor sit amet, consectetur adipiscing elit. Sed do eiusmod tempor incididunt ut labore et dolore magna aliqua."
      }
    },
    {
      "id": "image-0035",
      "type": "image",
      "content": {
        "src": "/images/image-35.jpg",
        "alt": "Image 35"
      }
    },
    {
      "id": "button-0036",
      "type": "button",
      "content": {
        "label": "Button 36",
        "href": "/page-36"
      }
    },
    {
      "id": "hero-0037",
      "type": "hero",
      "content": {
        "title": "Hero 37",
        "description": "Lorem ipsum dolor sit amet, consectetur adipiscing elit."
      }
    },
    {
      "id": "text-0038",
      "type": "text",
      "content": {
        "text": "Lorem ipsum dolor sit amet, consectetur adipiscing elit. Sed do eiusmod tempor incididunt ut labore et dolore magna aliqua."
      }
    },
    {
      "id": "image-0039",
      "type": "image",
      "content": {
        "src": "/images/image-39.jpg",
        "alt": "Image 39"
      }
    },
    {
      "id": "button-0040",
      "type": "button",
      "content": {
        "label": "Button 40",
        "href": "/page-40"
      }
    },
    {
      "id": "hero-0041",
      "type": "hero",
      "content": {
        "title": "Hero 41",
        "description": "Lorem ipsum dolor sit amet, consectetur adipiscing elit."
      }
    },
    {
      "id": "text-0042",
      "type": "text",
      "content": {
        "text": "Lorem ipsum dolor sit amet, consectetur adipiscing elit. Sed do eiusmod tempor incididunt ut labore et dolore magna aliqua."
      }
    },
    {
      "id": "image-0043",
      "type": "image",
      "content": {
        "src": "/images/image-43.jpg",
        "alt": "Image 43"
      }
    },
    {
      "id": "button-0044",
      "type": "button",
      "content": {
        "label": "Button 44",
        "href": "/page-44"
      }
    },
    {
      "id": "hero-0045",
      "type": "hero",
      "content": {
        "title": "Hero 45",
        "description": "Lorem ipsum dolor sit amet, consectetur adipiscing elit."
      }
    },
    {
      "id": "text-0046",
      "type": "text",
      "content": {
        "text": "Lorem ipsum dolor sit amet, consectetur adipiscing elit. Sed do eiusmod tempor incididunt ut labore et dolore magna aliqua."
      }
    },
    {
      "id": "image-0047",
      "type": "image",
      "content": {
        "src": "/images/image-47.jpg",
        "alt": "Image 47"
      }
    },
    {
      "id": "button-0048",
      "type": "button",
      "content": {
        "label": "Button 48",
        "href": "/page-48"
      }
    },
    {
      "id": "hero-0049",
      "type": "hero",
      "content": {
        "title": "Hero 49",
        "description": "Lorem ipsum dolor sit amet, consectetur adipiscing elit."
      }
    },
    {
      "id": "text-0050",
      "type": "text",
      "content": {
        "text": "Lorem ipsum dolor sit amet, consectetur adipiscing elit. Sed do eiusmod tempor incididunt ut labore et dolore magna aliqua."
      }
    }
  ]
}
